{
  "schemaVersion": "1.0.0",
  "ledgerId": "fluyo-native-auth-approval-history-v1",
  "sequence": 1,
  "previousRecordDigest": null,
  "recordedAtUtc": "2026-10-23T21:00:36.372Z",
  "eventType": "GOVERNANCE_SELECTION",
  "actor": "Marlon",
  "authority": {
    "kind": "direct_material_owner_authority",
    "grantedBy": "Marlon",
    "referenceRecordDigests": []
  },
  "subject": {
    "files": [
      {
        "path": "contracts/mobile/auth-readiness/v1/decision-policy.json",
        "sha256": "3e2aa6dabb4e9fe28b1b80e10f705f3df3968f85ed0e4e18ca8a0eb97ff9d696"
      },
      {
        "path": "contracts/mobile/auth-readiness/v1/evidence/index.json",
        "sha256": "162c0a25f5a4779b8e60abda00c9a9bf452a85cd7ea0a6b30cfe69d911ce96de"
      }
    ],
    "bundleSha256": "a18d7f6e37775993a816fbcfb8fef3477430a6e083d39a7b4fc5e1bf26ed777a"
  },
  "payload": {
    "selection": "APPEND_ONLY_CONTENT_ADDRESSED_SQUASH_COMPATIBLE",
    "effectiveFor": "future_native_auth_approval_and_phase_history",
    "retiredMechanism": "P_TO_A_TO_V_GIT_ANCESTRY_FOR_FUTURE_APPROVALS",
    "bootstrapCommit": "8ce28a7e57150ebf30499a447faee686ca50f3ce",
    "decisionPolicySha256": "3e2aa6dabb4e9fe28b1b80e10f705f3df3968f85ed0e4e18ca8a0eb97ff9d696",
    "evidenceIndexSha256": "162c0a25f5a4779b8e60abda00c9a9bf452a85cd7ea0a6b30cfe69d911ce96de"
  },
  "provenance": {
    "sourceCommit": "8ce28a7e57150ebf30499a447faee686ca50f3ce",
    "recordedBy": "Adriana",
    "recordingMethod": "repository_governance_record",
    "integrityScope": "canonical_record_bytes_and_declared_subject_bytes",
    "nonRepudiationLimitation": "repository_records_prove_integrity_and_declared_authority_after_recording_not_cryptographic_human_nonrepudiation"
  }
}
