{
  "actor": "Marlon",
  "authority": {
    "grantedBy": "Marlon",
    "kind": "direct_material_owner_authority",
    "referenceRecordDigests": []
  },
  "eventType": "DELEGATION_GRANT",
  "ledgerId": "fluyo-native-auth-approval-history-v1",
  "payload": {
    "delegate": "Adriana",
    "deniedActions": [
      "accept_any_of_fourteen_material_native_auth_decisions",
      "production_action",
      "credential_or_secret_action",
      "external_account_action",
      "dashboard_action",
      "domain_action",
      "signing_action",
      "store_action",
      "physical_device_action",
      "spend_action",
      "publication_or_release_action",
      "destructive_or_data_action"
    ],
    "materialDecisionIds": [
      "AUTH-SDK-IOS",
      "AUTH-SDK-ANDROID",
      "AUTH-METHODS",
      "AUTH-SIGNOUT-SCOPE",
      "AUTH-CALLBACK-DOMAINS",
      "AUTH-AASA",
      "AUTH-ASSETLINKS",
      "AUTH-SUPABASE-ALLOWLIST",
      "AUTH-STORAGE-IOS",
      "AUTH-STORAGE-ANDROID",
      "AUTH-NONPROD-CUSTODY",
      "AUTH-RECOVERY-DELIVERY",
      "AUTH-REVOCATION",
      "AUTH-ACCOUNT-DELETION"
    ],
    "requiredPhaseGates": [
      "Catalina architecture PASS",
      "Natalia security PASS",
      "Renata environment and CI PASS",
      "all relevant domain specialists PASS",
      "protected CI PASS",
      "Elana exact-head PASS last"
    ],
    "sameSubjectBundleRequired": true,
    "scope": "credential_free_repository_only_nonproduction_phase_after_required_gates",
    "usableOnlyAfterLedgerMerge": true
  },
  "previousRecordDigest": "5117830473b4eba9d3dcf45c938590b7886c746bd94354874ad2ae49fc5d91cb",
  "provenance": {
    "integrityScope": "canonical_record_bytes_and_declared_subject_bytes",
    "nonRepudiationLimitation": "repository_records_prove_integrity_and_declared_authority_after_recording_not_cryptographic_human_nonrepudiation",
    "recordedBy": "Adriana",
    "recordingMethod": "repository_governance_record",
    "sourceCommit": "8ce28a7e57150ebf30499a447faee686ca50f3ce"
  },
  "recordedAtUtc": "2026-10-23T21:00:36.372Z",
  "schemaVersion": "1.0.0",
  "sequence": 2,
  "subject": {
    "bundleSha256": "a18d7f6e37775993a816fbcfb8fef3477430a6e083d39a7b4fc5e1bf26ed777a",
    "files": [
      {
        "path": "contracts/mobile/auth-readiness/v1/decision-policy.json",
        "sha256": "3e2aa6dabb4e9fe28b1b80e10f705f3df3968f85ed0e4e18ca8a0eb97ff9d696"
      },
      {
        "path": "contracts/mobile/auth-readiness/v1/evidence/index.json",
        "sha256": "162c0a25f5a4779b8e60abda00c9a9bf452a85cd7ea0a6b30cfe69d911ce96de"
      }
    ]
  }
}
