{
  "schemaVersion": "1.0.0",
  "ledgerId": "fluyo-native-auth-approval-history-v1",
  "sequence": 4,
  "previousRecordDigest": "e3a28172f0e0979059629a8de6b50cacf5fc3e6b847e009f83e9e9f1149b3767",
  "recordedAtUtc": "2026-10-23T21:00:36.372Z",
  "eventType": "MIGRATION_SNAPSHOT",
  "actor": "Adriana",
  "authority": {
    "kind": "administrative_migration_recording",
    "grantedBy": "Marlon",
    "referenceRecordDigests": [
      "72c010af2f5a1efef3138cc348d5dc230c52a446a8798afa46a33617f656878c",
      "a5cf2b5d6e7eb94fffb19d0d683296eadb22ff782b5bf3c68d3ce928f5d42389",
      "e3a28172f0e0979059629a8de6b50cacf5fc3e6b847e009f83e9e9f1149b3767"
    ]
  },
  "subject": {
    "files": [
      {
        "path": "contracts/mobile/auth-readiness/v1/decision-policy.json",
        "sha256": "3e2aa6dabb4e9fe28b1b80e10f705f3df3968f85ed0e4e18ca8a0eb97ff9d696"
      },
      {
        "path": "contracts/mobile/auth-readiness/v1/evidence/index.json",
        "sha256": "162c0a25f5a4779b8e60abda00c9a9bf452a85cd7ea0a6b30cfe69d911ce96de"
      }
    ],
    "bundleSha256": "a18d7f6e37775993a816fbcfb8fef3477430a6e083d39a7b4fc5e1bf26ed777a"
  },
  "payload": {
    "governanceSelectionRecordDigest": "72c010af2f5a1efef3138cc348d5dc230c52a446a8798afa46a33617f656878c",
    "delegationGrantRecordDigest": "a5cf2b5d6e7eb94fffb19d0d683296eadb22ff782b5bf3c68d3ce928f5d42389",
    "toolingAuthorizationRecordDigest": "e3a28172f0e0979059629a8de6b50cacf5fc3e6b847e009f83e9e9f1149b3767",
    "materialDecisionIds": [
      "AUTH-SDK-IOS",
      "AUTH-SDK-ANDROID",
      "AUTH-METHODS",
      "AUTH-SIGNOUT-SCOPE",
      "AUTH-CALLBACK-DOMAINS",
      "AUTH-AASA",
      "AUTH-ASSETLINKS",
      "AUTH-SUPABASE-ALLOWLIST",
      "AUTH-STORAGE-IOS",
      "AUTH-STORAGE-ANDROID",
      "AUTH-NONPROD-CUSTODY",
      "AUTH-RECOVERY-DELIVERY",
      "AUTH-REVOCATION",
      "AUTH-ACCOUNT-DELETION"
    ],
    "decisionCounts": {
      "proposed": 5,
      "blocked": 9,
      "accepted": 0
    },
    "evidenceRequirements": {
      "total": 69,
      "unsatisfied": 69
    },
    "runtimeEvidence": {
      "conducted": 0,
      "passed": 0,
      "failed": 0,
      "unattempted": 24
    },
    "nativeMatrix": {
      "total": 24,
      "unattempted": 24
    },
    "materialDecisionApprover": "Marlon",
    "responsibleAfterApproval": "Adriana"
  },
  "provenance": {
    "sourceCommit": "8ce28a7e57150ebf30499a447faee686ca50f3ce",
    "recordedBy": "Adriana",
    "recordingMethod": "repository_governance_record",
    "integrityScope": "canonical_record_bytes_and_declared_subject_bytes",
    "nonRepudiationLimitation": "repository_records_prove_integrity_and_declared_authority_after_recording_not_cryptographic_human_nonrepudiation"
  }
}
